{
  "slug": "savvycal",
  "name": "SavvyCal",
  "domains": [
    "savvycal.com"
  ],
  "category": "scheduling",
  "subcategory": "booking links",
  "pricing": {
    "amount": 12,
    "currency": "USD",
    "plan": "Basic",
    "basis": "flat-monthly",
    "source": "https://savvycal.com/pricing",
    "checkedOn": "2026-07-30",
    "confidence": "high"
  },
  "verdict": "kinda",
  "verdictConfidence": "medium",
  "moatType": "calendar integration/polish",
  "diyTimeEstimate": "weekend",
  "requirements": [
    "hosting",
    "domain",
    "oauth-app",
    "email-provider"
  ],
  "alternatives": [
    {
      "project": "cal-com",
      "fit": "partial"
    }
  ],
  "relatedSlugs": [
    "calendly",
    "meetergo",
    "todoist"
  ],
  "markets": [
    "en",
    "fr"
  ],
  "pagePriority": 3,
  "verifiedOneShot": false
}
