{
  "slug": "reeder",
  "name": "Reeder",
  "domains": [
    "reederapp.com"
  ],
  "category": "read-it-later",
  "subcategory": "read-later, bookmarks and RSS",
  "pricing": {
    "amount": 1,
    "currency": "USD",
    "plan": "Reeder subscription",
    "basis": "flat-monthly",
    "source": "https://reederapp.com/",
    "checkedOn": "2026-07-31",
    "confidence": "medium"
  },
  "verdict": "yes",
  "verdictConfidence": "high",
  "moatType": "capture polish, sync, and content partnerships",
  "diyTimeEstimate": "one-sitting",
  "requirements": [
    "database"
  ],
  "alternatives": [
    {
      "project": "netnewswire",
      "fit": "partial"
    }
  ],
  "relatedSlugs": [
    "inoreader",
    "feedly",
    "newsblur-premium"
  ],
  "markets": [
    "en",
    "fr"
  ],
  "pagePriority": 4,
  "verifiedOneShot": false
}
