{
  "slug": "doodle",
  "name": "Doodle",
  "domains": [
    "doodle.com"
  ],
  "category": "scheduling",
  "subcategory": "booking links and calendar automation",
  "pricing": {
    "amount": 15,
    "currency": "USD",
    "plan": "Pro",
    "basis": "per-seat-monthly",
    "source": "https://doodle.com/en/premium",
    "checkedOn": "2026-07-31",
    "confidence": "high"
  },
  "verdict": "kinda",
  "verdictConfidence": "medium",
  "moatType": "calendar integrations and reliability",
  "diyTimeEstimate": "week",
  "requirements": [
    "hosting",
    "oauth-app",
    "database",
    "email-provider"
  ],
  "alternatives": [
    {
      "project": "cal-com",
      "fit": "partial"
    }
  ],
  "relatedSlugs": [
    "cal-com-teams",
    "fantastical",
    "calendly"
  ],
  "markets": [
    "en",
    "fr"
  ],
  "pagePriority": 4,
  "verifiedOneShot": false
}
