{
  "slug": "sellfy",
  "name": "Sellfy",
  "domains": [
    "sellfy.com"
  ],
  "category": "creator-commerce",
  "subcategory": "digital products, courses and memberships",
  "pricing": {
    "amount": 29,
    "currency": "USD",
    "plan": "Starter",
    "basis": "flat-monthly",
    "source": "https://sellfy.com/pricing",
    "checkedOn": "2026-07-31",
    "confidence": "high"
  },
  "verdict": "kinda",
  "verdictConfidence": "medium",
  "moatType": "payments, tax, distribution, and operations",
  "diyTimeEstimate": "week",
  "requirements": [
    "hosting",
    "domain",
    "database",
    "email-provider"
  ],
  "alternatives": [
    {
      "project": "medusa",
      "fit": "partial"
    }
  ],
  "relatedSlugs": [
    "payhip",
    "podia",
    "kajabi"
  ],
  "markets": [
    "en",
    "fr"
  ],
  "pagePriority": 4,
  "verifiedOneShot": false
}
