{
  "slug": "albato",
  "name": "Albato",
  "domains": [
    "albato.com"
  ],
  "category": "automation",
  "subcategory": "workflow automation and app integrations",
  "pricing": {
    "amount": 19,
    "currency": "USD",
    "plan": "Basic",
    "basis": "flat-monthly",
    "source": "https://albato.com/pricing",
    "checkedOn": "2026-07-31",
    "confidence": "medium"
  },
  "verdict": "no",
  "verdictConfidence": "high",
  "moatType": "connector breadth and execution reliability",
  "diyTimeEstimate": "one-sitting",
  "requirements": [
    "hosting",
    "domain",
    "database",
    "oauth-app"
  ],
  "alternatives": [
    {
      "project": "activepieces",
      "fit": "partial"
    }
  ],
  "relatedSlugs": [
    "pipedream",
    "ifttt",
    "relay-app"
  ],
  "markets": [
    "en",
    "fr"
  ],
  "pagePriority": 3,
  "verifiedOneShot": false
}
