{
  "slug": "involve-me",
  "name": "involve.me",
  "domains": [
    "involve.me"
  ],
  "category": "forms",
  "subcategory": "forms, surveys and lead capture",
  "pricing": {
    "amount": 29,
    "currency": "USD",
    "plan": "Starter",
    "basis": "flat-monthly",
    "source": "https://involve.me/pricing",
    "checkedOn": "2026-07-31",
    "confidence": "medium"
  },
  "verdict": "kinda",
  "verdictConfidence": "medium",
  "moatType": "integrations, deliverability, and workflow depth",
  "diyTimeEstimate": "one-sitting",
  "requirements": [
    "domain",
    "email-provider"
  ],
  "alternatives": [
    {
      "project": "formbricks",
      "fit": "partial"
    }
  ],
  "relatedSlugs": [
    "surveymonkey",
    "fillout",
    "paperform"
  ],
  "markets": [
    "en",
    "fr"
  ],
  "pagePriority": 3,
  "verifiedOneShot": false
}
