{
  "slug": "hootsuite",
  "name": "Hootsuite",
  "domains": [
    "hootsuite.com"
  ],
  "category": "social-media",
  "subcategory": "social scheduling and content repurposing",
  "pricing": {
    "amount": 99,
    "currency": "USD",
    "plan": "Standard",
    "basis": "annual-effective-monthly",
    "source": "https://hootsuite.com/plans",
    "checkedOn": "2026-07-31",
    "confidence": "medium"
  },
  "verdict": "no",
  "verdictConfidence": "high",
  "moatType": "API access, connector upkeep, and collaboration",
  "diyTimeEstimate": "one-sitting",
  "requirements": [
    "oauth-app"
  ],
  "alternatives": [
    {
      "project": "postiz-app",
      "fit": "full"
    },
    {
      "project": "mixpost",
      "fit": "full"
    },
    {
      "project": "trypost",
      "fit": "full"
    },
    {
      "project": "socioboard",
      "fit": "partial"
    },
    {
      "project": "threaduler",
      "fit": "niche"
    }
  ],
  "relatedSlugs": [
    "buffer",
    "typefully",
    "later"
  ],
  "markets": [
    "en",
    "fr"
  ],
  "pagePriority": 5,
  "verifiedOneShot": false
}
