{
  "slug": "accuranker",
  "name": "AccuRanker",
  "domains": [
    "accuranker.com"
  ],
  "category": "seo-marketing",
  "subcategory": "keyword research, backlinks and rank tracking",
  "pricing": {
    "amount": 129,
    "currency": "USD",
    "plan": "1,000 keywords",
    "basis": "flat-monthly",
    "source": "https://accuranker.com/pricing",
    "checkedOn": "2026-07-31",
    "confidence": "medium"
  },
  "verdict": "no",
  "verdictConfidence": "high",
  "moatType": "proprietary web index and data acquisition",
  "diyTimeEstimate": "one-sitting",
  "requirements": [
    "hosting",
    "database"
  ],
  "alternatives": [
    {
      "project": "serpbear",
      "fit": "partial"
    }
  ],
  "relatedSlugs": [
    "moz-pro",
    "ahrefs",
    "screaming-frog-seo-spider"
  ],
  "markets": [
    "en",
    "fr"
  ],
  "pagePriority": 4,
  "verifiedOneShot": false
}
