{
  "slug": "seobility",
  "name": "Seobility",
  "domains": [
    "seobility.net"
  ],
  "category": "seo-marketing",
  "subcategory": "technical audits and on-page optimization",
  "pricing": {
    "amount": 49.9,
    "currency": "USD",
    "plan": "Premium",
    "basis": "flat-monthly",
    "source": "https://seobility.net/en/pricing/",
    "checkedOn": "2026-07-31",
    "confidence": "medium"
  },
  "verdict": "kinda",
  "verdictConfidence": "medium",
  "moatType": "crawl scale, rule depth, and operational polish",
  "diyTimeEstimate": "week",
  "requirements": [
    "database"
  ],
  "alternatives": [
    {
      "project": "seonaut",
      "fit": "partial"
    }
  ],
  "relatedSlugs": [
    "sitebulb",
    "screaming-frog-seo-spider",
    "pageoptimizer-pro"
  ],
  "markets": [
    "en",
    "fr"
  ],
  "pagePriority": 3,
  "verifiedOneShot": false
}
