{
  "slug": "post-bridge",
  "name": "Post Bridge",
  "domains": [
    "post-bridge.com"
  ],
  "category": "social-media",
  "subcategory": "social scheduling + cross-posting",
  "pricing": {
    "amount": 29,
    "currency": "USD",
    "plan": "Creator",
    "basis": "flat-monthly",
    "source": "https://www.post-bridge.com/pricing",
    "checkedOn": "2026-07-30",
    "confidence": "high"
  },
  "verdict": "kinda",
  "verdictConfidence": "high",
  "moatType": "platform-approved OAuth apps + integration upkeep",
  "diyTimeEstimate": "week",
  "requirements": [
    "hosting",
    "database",
    "oauth-app"
  ],
  "alternatives": [
    {
      "project": "postiz-app",
      "fit": "partial"
    }
  ],
  "relatedSlugs": [
    "buffer",
    "later",
    "typefully"
  ],
  "markets": [
    "en",
    "fr"
  ],
  "pagePriority": 4,
  "verifiedOneShot": false
}
