{
  "slug": "livechat",
  "name": "LiveChat",
  "domains": [
    "livechat.com"
  ],
  "category": "customer-support",
  "subcategory": "live chat for sales and support",
  "pricing": {
    "amount": 19,
    "currency": "USD",
    "plan": "Starter",
    "basis": "annual-effective-monthly",
    "source": "https://www.livechat.com/pricing/",
    "checkedOn": "2026-07-31",
    "confidence": "high",
    "notes": "$19 per person per month billed annually; $25 billed monthly. AI chatbots are a separate product starting at $52 a month."
  },
  "verdict": "kinda",
  "verdictConfidence": "medium",
  "moatType": "agent throughput tooling",
  "diyTimeEstimate": "weekend",
  "requirements": [
    "hosting",
    "domain",
    "database"
  ],
  "alternatives": [
    {
      "project": "chatwoot",
      "fit": "partial"
    }
  ],
  "relatedSlugs": [
    "crisp",
    "tidio",
    "intercom"
  ],
  "markets": [
    "en",
    "fr"
  ],
  "pagePriority": 4,
  "verifiedOneShot": false
}
