{
  "slug": "avoma",
  "name": "Avoma",
  "domains": [
    "avoma.com"
  ],
  "category": "meeting-notes",
  "subcategory": "meeting transcription and AI notes",
  "pricing": {
    "amount": 29,
    "currency": "USD",
    "plan": "Startup",
    "basis": "annual-effective-monthly",
    "source": "https://avoma.com/pricing",
    "checkedOn": "2026-07-31",
    "confidence": "medium"
  },
  "verdict": "no",
  "verdictConfidence": "high",
  "moatType": "capture reliability, integrations, and collaboration",
  "diyTimeEstimate": "one-sitting",
  "requirements": [
    "hosting"
  ],
  "alternatives": [
    {
      "project": "whisper-cpp",
      "fit": "partial"
    }
  ],
  "relatedSlugs": [
    "fathom-ai",
    "granola",
    "fireflies-ai"
  ],
  "markets": [
    "en",
    "fr"
  ],
  "pagePriority": 4,
  "verifiedOneShot": false
}
